Datum,Rating,Ldfnr,Produkt,Version,Bemerkungen,vorinstall,Quelle,Lizenztyp,Lizenzgeber,Lizenzbestimmungen,instlocation,Herstellerwebsite
"2022-01-17 10:00:00","0","471","64 Bit HP CIO Components Installer","22.2.1","HP Druckertreiber-Komponente","","Internet","Treibersoftware","HP","","sc",""
"2022-07-17 18:55:33","10","1","7-Zip (x64)","22.01","kostenfreies Open-Source-Packprogramm (64-Bit Version, NSIS Installer mit RAR 6 Unterstützung). Mit 7zSFX Oberfläche (aus Innosetup-Bundle) für Autoinstallations-Dateien zur Software-Verteilung nutzbar. Bugfixes und neue Funktionen, RAR6-Unterstützung, schnellere Kompressionsverfahren. Achtung: Nach der Installation die Hilfedatei: 7-zip.chm löschen!","Deploy, Repack","Internet","GPL-Lizenz, kostenfrei","7-Zip Org","Lizenzbestimmungen im Installationspaket","sc","https://www.7-zip.org/"
"2022-03-08 12:23:23","10","2","7-Zip SFX-Creator","1.3","Werkzeug für Installationspakete mit GUI für 7-Zip, in Kombination mit Ressource Hacker für eigene Paket-Icons. Google Quellcode Seite leider eingestellt, Im Gegensatz zur 7-Zip Oberfläche kann hier eine auszuführende Datei angegeben werden beim Erstellen. Repack im Innosetup Bundle enthalten.","Deploy, Repack","Internet","GPL-Lizenz, kostenfrei","SFX-Creator project","Lizenzbestimmungen im Installationspaket","c",""
"2021-10-03 11:31:53","8","427","ADB Platform Tools Debloat android","2021-07","Android Smartphones können bei aktiviertem Entwicklermodus (Einstellungen/Telefoninfo/Softwareinformationen/Build-Nummer mehrfach antippen, bis Meldung erscheint) und im Entwicklermenü aktiviertem USB-Debugging von Werbung und unerwünschten Apps befreit werden, die sich sonst nicht deinstallieren lassen. Dazu wird in der ADB SHELL das Kommando PM -k verwendet und der Package Name angegeben. ","Deploy, Repack","Internet","kostenfrei auch kommerziell","GitHub Projekt","","c","https://github.com/fawazahmed0/Latest-adb-fastboot-installer-for-windows"
"2020-01-17 10:00:00","0","460","Adobe Acrobat DC","CC","Mietsoftware im Rahmen der Creative Cloud","","aus Originalquelle","Lizenzsoftware","Adobe Inc.","","c",""
"2022-07-15 13:55:21","1","450","Adobe Acrobat Reader DC - Deutsch","22.001.20142","PDF-Betrachter. Da das Produkt mittlerweile ziemlich ressourcenhungrig ist und langsam, ist der Einsatz des PDF-Viewers des Browsers Chrome oder Edge zu empfehlen. Der Reader kann dann deinstalliert werden, Wenn nicht, stets die aktuelle Version einsetzen","","Internet","kostenfrei auch kommerziell","Adobe Inc.","im Installationspaket","x","https://www.adobe.com/devnet-docs/acrobatetk/tools/ReleaseNotesDC/index.html"
"2020-01-17 10:00:00","0","461","Adobe Creative Cloud","CC","Mietsoftware im Rahmen der Creative Cloud, enthält Photoshop, InDesign und andere Grafikwerkzeuge, nicht für Terminalserver geeignet","","aus Originalquelle","Lizenzsoftware","Adove Inc.","","c",""
"2022-05-16 10:06:56","10","9","Advanced IP Scanner","2.5.4594.1","Netzwerk IP-Scanner, Inventarisierung, Standardports scanbar aus der Anwendung, Export als CSV und HTML, Portable Version, kann direkt ausgeführt werden ohne Installation, Bugfix Release","Deploy, Repack","aus Originalquelle","kostenfrei auch kommerziell","Famatech","Lizenzbestimmungen im Installationspaket","c","https://www.advanced-ip-scanner.com/de/"
"2016-01-30 10:00:00","10","11","AMOK Playlist Copy","2.07","Musiktool für MP3-Dateien zum Erstellen von Wiedergabelisten durch Kopie der Datei in einen Ordner und Nummerierung der Dateinamen im Ausgabeordner in Reihenfolge der eingelesenen M3U-Datei","Deploy, Repack","aus Originalquelle","kostenfrei auch kommerziell","Dirk Paehl","Lizenzbestimmungen im Installationspaket","c","https://www.amok.am/"
"2018-03-28 10:00:00","8","12","APC Powerchute Business Edition","9.5.6","USV-Betriebssoftware und Treiber für USB oder serielle Direktverbindung mit Pserver","optional","aus Originalquelle","kostenfrei auch kommerziell","APC","Lizenzbestimmungen im Installationspaket","s","http://www.apc.com/de/de/"
"2016-01-30 10:00:00","10","13","APC Powerchute Network Shutdown","3.01","Netzwerk-Agent zum Herunterfahren von Servern phys/virt, wenn USV Netzwerkkarte hat","optional","aus Originalquelle","kostenfrei auch kommerziell","APC","Lizenzbestimmungen im Installationspaket","s","http://www.apc.com/de/de/"
"2021-12-23 15:33:32","10","15","Audacity Editor","3.1.3","Musik-Bearbeitungssoftware zum Bearbeiten, Konvertieren und Erzeugen von MP3 Dateien, mit Effekten und Amplitudendarstellung, Schneidewerkzeugen und Filtern. Benutzt lameMP3 Codec. Nyquist Filter erlauben Tonmodifikationen. Es gibt weitere Plugins auf der Projektwebsite.","Deploy, Repack","Internet","GPL-Lizenz, kostenfrei","GPL","Lizenzbestimmungen im Installationspaket","c","https://www.audacityteam.org/download/"
"2022-05-21 12:48:23","10","16","AusweisApp2","1.22.6","Programm zum Nutzen der E-Signatur im elektronischen Personalausweis e-Perso, Statt eines USB NFC-Lesers kann ein NFC fähiges Smartphone remote als Leser dienen. Android und IOS Apps gibt es ebenfalls.","Deploy","aus Originalquelle","kostenfrei auch kommerziell","Governikus KG, Bundesregierung","Lizenzbestimmungen im Installationspaket","sc","https://www.ausweisapp.bund.de/download/"
"2021-12-28 16:26:55","10","19","AVIDemux","2.8.0","Videobearbeitungs-Werkzeug (ähnlich Virtualdub aber aktueller, Installer auch im Paket Video-Tools), zum schneiden und konvertieren von Videos. Zahlreiche Effekte wie Titeleinblendung und Timelapse und Crop stehen zur Verfügung. Viele Ausgabeformate können konvertiert werden. Bugfixes und Verbesserungen in der Geschwindigkeit","Deploy, Repack","Internet","GPL-Lizenz, kostenfrei","GPL","Lizenzbestimmungen im Installationspaket","","https://sourceforge.net/projects/avidemux/files/"
"2020-04-10 08:00:37","10","390","AVM Zack - Leitungs-Speed Test","1.0","Bandbreite, Datendurchsatz, PING-Zeiten und Jitter-Zeit ermitteln und messen. Werbefreie Seite","","","","","","","http://scope.avm.de/zack3g/zack.html"
"2016-01-30 10:00:00","10","21","BatteryBar","3.6.6","Akkulaufzeitanzeige in der Taskleiste (Zeit/Prozent) und Gesundheitszustand Akku, läuft als Dienste im Hintergrund. Dies ist die kostenlose Version","Deploy, Repack","aus Originalquelle","kostenfrei nichtkommerziell, Lizenz kommerziell","Osiris Development","Lizenzbestimmungen im Installationspaket","c","https://www.batterybarpro.com/"
"2022-07-30 14:55:38","10","22","Bginfo","4.31.0.0","Microsoft (Sysinternals) Werkzeug für automatisches Hintergrundbild mit System-Informationen mit Zusatzskripten und Logout/Reboot/Shutdown Icons. Optional: RDCMan 2.90, Imago Schrittaufzeichnung, MHT-HTML-Konverter, Filedate-Tool, Putty Terminal. Erfordert 64-Bit System. 32-Bit Variante entfernt. Putty und Rdcman aktualisiert","Deploy, Repack","aus Originalquelle","kostenfrei auch kommerziell","Microsoft","Lizenzbestimmungen im Installationspaket","sc","https://docs.microsoft.com/de-de/sysinternals/downloads/bginfo"
"2018-09-24 10:00:00","4","26","CDBurner XP","4.5.8","Brennsoftware für CD/DVD, Unbedingt 64 Bit Version Standardinstallation oder Portable ohne Adware nehmen","","aus Originalquelle","kostenfrei auch kommerziell","Canneverbe Limited","Lizenzbestimmungen im Installationspaket","c","https://cdburnerxp.se/"
"2021-10-03 11:48:20","10","428","Chansort für Panasonic TVs","2021-09","für Panasonic Viera TV-Geräte - Senderliste im Hotelmodus auf USB-Stick auslesen, am PC neu sortierenm neue Favoriten anlegen und Liste über Stick ins TV-Gerät zurückschreiben.","Deploy, Repack","Internet","GPL-Lizenz, kostenfrei","GitHub Projekt","","c","https://github.com/PredatH0r/ChanSort/releases"
"2016-01-30 10:00:00","5","28","Chipcardmaster","7.0.8","Chipkarten Daten auslesen (Handy-SIM, EC-Karten, andere Chipkarten) und wenn möglich ändern (SIM-Telefonbuch)","Deploy","aus Originalquelle","kostenfrei auch kommerziell","Dr. Olaf Jacobsen","Lizenzbestimmungen im Installationspaket","c","http://www.chipcardmaster.de/"
"2022-06-17 10:23:54","8","29","Cisco AnyConnect Secure Mobility Client","4.10.05111","VPN Einwahl in Firmennetzwerk (nur in Verbindung mit Cisco Router Hardware). Zum Verbinden von Windows Rechnern und Notebooks via vpn mit CISCO ASA Routern und -Firewalls - aktuelle Versionen schließen meist kritische Sicherheitslücken und sollten daher zeitnah installiert/verteilt werden. Kritische Sicherheitslücken wurden  geschlossen. Support nur mit gültigem CISCO Wartungsvertrag.","Deploy","aus Originalquelle","Hardwaregebunden CISCO Hardware","Cisco","www.cisco.com/web/siteassets/legal/terms_condition.html","c","https://www.cisco.com/"
"2018-06-04 10:00:00","10","30","Citrix Receiver for Windows","14.12.0.1820","verwendbar mit Citrix Servern (Client, Online Plugin)","optional","aus Originalquelle","kostenfrei auch kommerziell","Citrix","www.citrix.com/site/aboutCitrix/legal/secondLevel.asp?level2ID=2209","c","https://www.citrix.com/"
"2022-07-15 13:31:41","10","31","Citrix XenDesktop","7.18","Terminalserver-Erweiterung (zusätzlich zu den RDS Lizenzen erforderlich) für die Microsoft RDS Dienste, bietet Comport-Umleitung und schnelleres ICA-Protokoll, sowie besseres Loadbalancing bei mehreren Servern. Auch als XenApp bekannt. Version 1912 LTSR wird noch unterstützt.","optional","aus Originalquelle","Lizenzsoftware mit Online-Aktivierung","Citrix","www.citrix.com/site/aboutCitrix/legal/secondLevel.asp?level2ID=2209","s","https://www.citrix.com/"
"2022-01-09 10:52:10","10","32","Clonezilla","20220103-impish","Festplatten für Hardwareupgrade spiegeln (Boot von USB). Dazu die ISO-Datei von den Projektseiten herunterladen und mit #Rufus davon einen USB-Bootstick erstellen. Medium: mindestens 8GB. Zum Spiegeln auf eine größere Platte müssen die erweiterten Einstellungen gewählt werden. Dies ist die alternative stable Version, die ubuntu Linux enthält","Deploy","Internet","GPL-Lizenz, kostenfrei","GPL","sourceforge.net/projects/clonezilla/","c","https://clonezilla.org/"
"2020-04-10 08:00:37","0","258","Computerbase Windows Downloads RSS","1.0","Die aktuellen Downloads von Computerbase als Atom/Rss Feed abonnierbar","","","","","","","https://www.computerbase.de/rss/downloads.xml"
"2021-09-24 12:27:10","10","423","Contact Conversion Wizard","3.5.0.2","quelloffenes Fritzbox-Telefonbuch-Converter zum Import von Kontakten aus Outlook in das Fritz!Box-Telefonbuch und andere Formate. Braucht keine Installation, direkt aufrufbar.","Deploy","Github","GPL-Lizenz, kostenfrei","GitHub Projekt","im Setup-Paket enthalten","c","https://github.com/Rillke/Contact-Conversion-Wizard/releases"
"2022-07-15 13:10:29","0","442","d.3 server","8.1.0.50","Archivierungssoftware der GWS zur Anbindung an gevis ERP. Hersteller: d.velop, benötigt einen Microsoft SQL-Server und mindestens Windows Server 2016","","aus Originalquelle","Lizenzsoftware","GWS mbH","","s","https://gws.ms"
"2022-01-27 17:26:39","1","479","david","12.00a","Kommunikationssoftware (Serverdienst, Clients) für Faxversand, E-Mail-Server mit ActiveSync, Anrufbeantworter und Telefoniefunktionen mit Sprachausgabe (IVR, ACD). Mail to Fax und Fax over IP nur eingeschränkt. Bestenfalls auf Fax verzichten oder Microsoft Exchange online mit Officemaster ab 7.1 einsetzen.","","Internet","Lizenzsoftware","Tobit Software","auf der Internetseite","x","tobit.software"
"2020-04-10 08:00:37","0","254","Deskmodder Windows 10 Blog RSS","1.0","Kanal mit interessanten Informationen zu Windows und android zum Abonnieren","","","","","","","https://www.deskmodder.de/blog/category/windows-10/feed/"
"2022-02-19 16:22:44","8","37","DirectUpdate","4.8.1","Windows Dienst, der diverse Dyndns Anbieter aktualisieren kann und Reports erstellt. Verwaltet und aktualisiert mehrere Konten. Für ein einzelnes Konto kann auch der DNS-Dienst einer FritzBox verwendet werden.","Deploy","Internet","Lizenzsoftware","William Levra-Juillet","Lizenzbestimmungen im Installationspaket","s","https://www.directupdate.net/index.php/download-du"
"2022-07-24 10:09:31","10","392","DisplayLink Graphics","10.2 M4","Software und Treiber für Dockingstationen. Viele USB3 und Thunderbolt-Dockingstations (z. B. von Raidsonic, Targus) nutzen den Displaylink Chipsatz. Windows 10 erkennt ihn und installiert einen eigenen Treiber, der extrem langsam und nicht performant ist. So liefert die Netzwerkkarte nur rund 300MBit. Mit dem Chip-Hersteller (Synaptics) Treiber und der Einstellungen-Software von DisplayLink (R) wird die Verbindung und das Bild selbst bei Anschluß eines UHD Geräts flüssig.","Deploy","Internet","kostenfrei auch kommerziell","Synaptics Inc","im Installationspaket","c","https://www.displaylink.com/downloads/windows"
"2022-03-20 10:46:19","10","39","Dymo Connect","1.4.3.131","Software für USB Dymo Labelwriter Beschriftungsgeräte (MSI-Datei über Aufruf C:\temp\DCDSetup.exe /s /x /b ´´c:\temp´´ /v ´´/qn´´ extrahieren und danach nur MSI installieren. Ansonsten wird Bonjour und unnützes Zeug mit installiert). Nachfolger von Dymo Label Software.","Deploy","aus Originalquelle","kostenfrei","Dymo","Lizenzbestimmungen im Installationspaket","c","https://www.dymo.de/support?cfid=online-support"
"2022-07-15 14:06:43","0","453","E-POSTBUSINESS BOX","1.0","Kuvertierungs- und Versandlösung der Deutschen Post AG. Funktioniert nur in On-Prem- und IaaS-Umgebungen. Je nach Lösung (SaaS) ist DocuGuide als Nachfolger erforderlich.","","Internet","Hardwaregebunden PostBox","","","sc","https://www.deutschepost.de/de/e/epost/geschaeftskunden/epost-business-box.html"
"2022-07-27 13:04:37","10","256","Eclipse Temurin JRE mit Hotspot","8.0.342.7","32-Bit / 64-Bit Open Source Runtime GPLv2 Binaries, kompatibel mit JRE 8 mit Longterm Support, Ausführen von Java Programmen, kein Browserplugin!  Meistens 32-Bit Version benötigt, kann beides installiert werden. .msi Paket installieren und alle Optionen ankreuzen, damit es kompatibel zur ehemaligen Oracle Variante wird.","Deploy","Internet","GPL-Lizenz, kostenfrei","Adopt OpenJDK Project","Lizenzbestimmungen im Installationspaket","sc","https://adoptopenjdk.net/nightly.html?variant=openjdk8&jvmVariant=hotspot"
"2021-01-26 13:43:01","0","473","ElsterFormular","XX","ehemalige Software für Online-Aktionen mit dem Finanzamt. Mittlerweile Elster Portal. Softwareinhalte können wenn nicht ausgedruckt meist in  das Portal importiert werden. Ansonsten nötige Belege ausdrucken oder als PDF archivieren.","","","","","","x","https://www.elster.de/eportal/login/softpse"
"2021-10-27 13:50:47","10","417","Eraser","6.2.0.2993","Software zum sicheren Löschen von Festplatten, SSDs und Speichersticks vor Entsorgung/Abgabe solcher Geräte (kostenlos, Open-Source), 64-Bit von Juli 2021, aktuelle Version immer auf der Website. Dazu braucht man einen Windows Rechner, wo die zu löschenden Medien über SATA oder USB angeschlossen werden. Gelöscht werden dann diese zusätzlichen Datenträger. Das dauert je nach Größe schon mal ein paar Stunden.","Deploy","Internet","GPL-Lizenz, kostenfrei","Eraser Project","im Installationspaket","c","https://eraser.heidi.ie/download/"
"2022-04-01 10:20:57","10","46","Faststone Image Viewer","7.6","Bildbetrachter und Foto-Manager wie ACDSee, funktioniert offline, Massenbearbeitung, Vorschau- und Druckaufbereitung, auch als Portable Version verfügbar. Portable Version bevorzugt, da alle Dateien in einem Ordner. Faststone.db enthält Thumbs-Datenbank und liegt im User-Profil-Ordner. Neue Datenbank, performanter.","Deploy, Repack","aus Originalquelle","kostenfrei nichtkommerziell, Lizenzsoftware kommerziell","Faststone","Lizenzbestimmungen im Installationspaket","c","https://www.faststone.org/FSViewerDetail.htm"
"2020-10-27 20:33:35","10","48","Ferrari Officemaster Fax","7.12","Faxlösung (deutscher Hersteller aus Berlin) mit Microsoft Exchange Integration Mail-to-Fax, cloudfähig und für kompatible SIP-Anschlüsse geeignet. Soll ISDN-Nebenstelle genutzt werden, ist ein Officemaster Gate (OMG) erforderlich","optional","aus Originalquelle","Lizenzsoftware (Mainrelease)","Ferrari Electronic","www.ferrari-electronic.de/de/produkte/officemaster-fuer.html","s","https://www.ferrari-electronic.de/"
"2022-07-23 09:52:06","10","50","Filezilla","3.60.2","FTP-Client: FTP Datentransfer Programm zum Übertragen von Dateien mit SFTP und FTPS-Möglichkeit, ähnlich aufgebaut wie der Norton Commander (Explorer linke Seite: Mein Rechner, rechte Seite Verzeichnisstruktur Anbieter). Auch für den fortgeschrittenen Transfer von Webseiten-Inhalten und Websicherungen geeignet. Bitte die 64-Bit-Version verwenden. Bugfixes, Stabilisierungen","Deploy, Repack","Internet","GPL-Lizenz, kostenfrei","Filezilla Org","www.filezilla.de/gpl_en.htm","c","https://filezilla-project.org/download.php?show_all=1"
"2022-07-29 14:34:52","10","434","Fluent Reader","1.1.2.0","RSS und ATOM Reader für Windows Desktop (für Windows Desktop kostenlos, Quellcode auf GITHub verfügbar, als UWP-App im Windows Store und für apple Mac nur gegen Gebühr), 64-Bit Portabel Version. Stellt RSS-Feeds anschaulich als Kacheln oder Liste mit Bildern dar. Basiert auf CEF2 Chromium Engine. Updates und Fixes.","Deploy, Repack","Github","GPL-Lizenz, kostenfrei","GitHub Projekt","auf der Github-Projektseite","c","https://github.com/yang991178/fluent-reader/releases"
"2021-09-26 12:16:23","0","426","Fotowall","1.0","Erstellen von Collagen durch Drag&Drop, Bilder drehen, vergrößern und anordnen mit der Maus, Textwolken hinzufügen aus Textdateien, Rahmen, Schatten, Transparenz und weitere Bildeffekte möglich","Deploy, Repack","Internet","GPL-Lizenz, kostenfrei","Enrico Ros","im Setup-Paket enthalten","","https://www.enricoros.com/opensource/fotowall/download/binaries/"
"2020-01-17 10:00:00","0","456","FreePDF (Remove only)","xp","veraltet, unsicher, entfernen, PDF24 Creator ist besser","","Internet","kostenfrei auch kommerziell","","","x",""
"2022-01-05 15:04:50","10","58","Fritz!box 6490 cable Firmware","7.29","Betriebssystem (Linux Flash Firmware) für Internet-Router/Heimtelefonanlage/VoIP und DECT - vodafone (ehemals Unitymedia/Liberty Group) Branding, Updates werden durch den Kabelanbieter automatisch remote installiert. Unterstützt nun WPA3/2 Mixed mode","","aus Originalquelle","kostenfrei","AVM Berlin","Lizenzbestimmungen bei der Installation","","https://avm.de/produkte/fritzbox/fritzbox-6490-cable/"
"2019-09-26 13:44:23","10","59","Fritz!box 7390 Firmware","6.86","Betriebssystem für Internet-Router/Heimtelefonanlage/VoIP (VDSL-Modell)","","aus Originalquelle","kostenfrei","AVM Berlin","Lizenzbestimmungen bei der Installation","","https://avm.de/service/fritzbox/fritzbox-7390/uebersicht/"
"2022-01-02 15:04:28","10","60","Fritz!Repeater 1750E","7.29","WLAN-Accesspoint oder Wifi-Repeater mit Gigabit-LAN Anschluss und ac Dualmode WLAN, Ermöglicht WLAN-Verbindung mit ca. 900 MBit durch Kanalbündelung. Mit AVM Mesh Funktion. Bugfix-Release","","aus Originalquelle","kostenfrei","AVM Berlin","Lizenzbestimmungen bei der Installation","","https://avm.de/service/fritzwlan/fritzwlan-repeater-1750e/uebersicht/"
"2022-07-15 14:13:33","0","454","gevis Warenwirtschaft","6.00.33277","gevis Classic Version, basiert auf Dynamics NAV 2009 R2, wird abgelöst durch gevis ERP|BC (Microsoft Dynamics 365 Business Central, On-Premises und IaaS) oder gevis ERP|VEO (SaaS)","","aus Originalquelle","Lizenzsoftware","GWS mbH","","sc","https://gws.ms/gevis-erp-business/"
"2022-07-14 18:10:58","0","394","Github Desktop","3.0.5","Grafische Oberfläche zum Verwalten und synchronisieren von Git Repositories zwischen GitHub und dem lokalen Rechner. GitHub gehört zu Microsoft, es gibt Github (kostenlos, Open Source) und Github Enterprise (kostenpflichtig im Abo). Installation per User unter %appdata% oder über das .MSI Paket maschinenweit. Seit 2.8.0 in  64-Bit.","Deploy","Internet","GPL-Lizenz, kostenfrei","GitHub Projekt","im Installationspaket und auf der Webseite","c","https://desktop.github.com/"
"2022-07-20 15:40:09","10","437","Google Chrome","103.0.5060.134","Empfohlener Standard-Browser. Google Browser auf Chromium-Basis, Autoupdates, PDF-Betrachter mit Formfill, Chrome Enterprise MSI Paket 64-Bit standalone. Gruppenrichtlinien im Chrome Bundle. In Central Store importieren/konfigurieren.","Deploy","aus","kostenfrei auch kommerziell","Google Inc.","Auf Google Cloud Website und chrome://terms","sc","https://cloud.google.com/chrome-enterprise/browser/download/?hl=de"
"2020-08-02 10:45:23","10","66","Google Chrome Extension: Fast Dial","1.1.0","Schnellwahl mit Vorschaubildern als Startseite für Chrome (wie bei Opera Speed Dial)","","Google-Chrome","GPL-Lizenz, kostenfrei","Stepanov E.V.","Lizenzbestimmungen bei der Installation","c","https://chrome.google.com/webstore/detail/fast-dial/fdnbdgmkhikelgaohpgdpcecklddmpaj"
"2021-05-19 14:24:51","10","67","Google Chrome Extension: Shoyu RSS/Atom Feed","2.0.3.18","Zeigt oben rechts an, ob eine Seite einen oder mehrere RSS Feeds anbietet und stellt sie in lesbarer Form mit Bildern im Browser dar. Klickt man auf den kleinen Punkt in der Überschrift, wird der RSS XML-Code sichtbar (für Entwickler)","","Google-Chrome","GPL-Lizenz, kostenfrei","Google","Lizenzbestimmungen bei der Installation","c","https://chrome.google.com/webstore/detail/shoyu-rssatom-feed-previe/ilicaedjojicckapfpfdoakbehjpfkah"
"2021-03-15 09:15:33","10","69","Google Chrome Extension: Ublock Origin","1.33.2","Effizienter Adblocker als Open Source auf Basis zahlreicher Listen mit Anti-Adblocker-Listen und Adblocker-Versteckfunktionen. Funktioniert auch mit dem Microsoft Edge on Chromium.","","Google-Chrome","GPL-Lizenz, kostenfrei","gorhill","Lizenzbestimmungen bei der Installation","c","https://chrome.google.com/webstore/detail/ublock-origin/cjpalhdlnbpafiamejdnhcphjbkeiagm"
"2022-01-17 10:00:00","0","465","GoTo Opener","XX","genutzt für Webinare","","Internet","Clients kostenfrei für Besucher","LogMeIn, Inc.","","c",""
"2022-04-11 13:03:51","6","74","GPL Ghostscript","9.56.1","Erzeugen von PDF-Dateien aus Postscript, wird von vielen Programmen wie Paint.net (PSD-Dateien und EPS-Dateien Filter) und PDF-Druckern benutzt, meist die 64-Bit-Version, in Ausnahmen die 32-Bit-Version (je nach Client Anwendung 64 oder 32 Bit wählen), Sicherheitsupdate, neuer Interpreter aktiviert","optional","Internet","AGPL-Lizenz, kostenfrei","GNU Affero General Public License","ghostscript.com/doc/current/COPYING","sc","https://ghostscript.com/"
"2020-01-17 10:00:00","0","457","Greenshot","1.5","ShareX ist besser, Greenshot nicht aktuell","","Internet","GPL-Lizenz, kostenfrei","GPL Projekt","","x",""
"2022-04-17 12:13:01","9","439","gTool","1.8.1","Adressbuchsynchronisation mit Gigaset Telefonen. Je nach Modell ist auch Dateizugriff für Bilder/Klingeltöne möglich. Anschlussart: Serielles Kabel und Lumberg-Stecker für die SL-DECT-Modelle, Micro-USB-Kabel für die CL und S-Modelle der neueren Generation ab 2019. Enthält virtuellen Comport_Treiber seriell. Für Firmware-Updates wird Quicksync benötigt. Wenig störende Werbe-Einblendungen im Programm beim Aufruf.","Deploy","Internet","kostenfrei auch kommerziell","Gigaset GmbH","im Installationspaket","c","https://www.gtool.de/"
"2022-07-15 14:17:23","0","455","GWS Managed-Transfer-Client  (x64)","4.20","Asymmetrische Datenübertragung über gesichertes VPN zwischen Kunden und Lieferanten durch die GWS, für EDI und andere Verbunddienste nutzbar","","aus Originalquelle","Lizenzsoftware","GWS mbH","","s","https://erpsystem.de/wp-content/uploads/2020/05/Datenblatt-Managed_Transfer.pdf"
"2020-04-10 08:00:37","0","255","Heise Security RSS","1.0","Sicherheitsnachrichten vom Heise Verlag, per Atom oder RSS Feeder abonnierbar","","","","","","","https://www.heise.de/security/rss/news-atom.xml"
"2020-01-17 10:00:00","0","458","I.R.I.S. XMailFetcher 5.0.5","5.0.5","wenn das Mailarchiv über s.dok abgebildet wird oder per E-Mail Dokumente ins Archiv müssen","","aus Originalquelle","Lizenzsoftware","I.R.I.S AG","","s",""
"2020-01-17 10:00:00","0","462","IBM Data Server Runtime Client - DB2COPY1","XX","alte Datenbank von s.dok, wird auf Microsoft SQL-Server Lizenz umgestellt","","aus Originalquelle","kostenfrei auch geschäftlich","d.velop AG/IBM","","s",""
"2021-03-13 11:34:49","0","408","Image Resizer for Windows","3.1.2","Bilder verkleinern auf verschiedene Größen (über das Kontextmenü, stapelweise alle markierten Bilder auf ein kleineres Format bringen). Neuerdings Bestandteil der Microsoft Powertoys. Wer das Riesenpaket der Powertoys nicht installieren möchte, nimmt diese 1MB große Explorer Erweiterung. Ideal für Handy-Fotos, die als Internet-Bilder auf die Webseiten sollen.","Deploy","Internet","kostenfrei auch kommerziell","Microsoft bzw. Brice Lambson","im Installationspaket","c","https://www.bricelam.net/ImageResizer/"
"2022-06-14 21:11:47","10","251","Imageglass Viewer","8.6.7.13","sehr schneller und kompakter Open-Source-Bildbetrachter mit vielen Formaten zum schnellen Durchblättern von Fotoserien mit Basis-Bearbeitungs-Funktionen. Auch als Portable-Version, Design anpassbar, externe Bildbearbeitung mit Hotkey E einbindbar. TIFF-Anzeige, EXIF-Informationen, Zoom und Druckfunktionen. Ersatz für  Windows Fotoanzeige und Windows Fotos App. Moon-Version mit neuen Features.","Deploy, Repack","Github","GPL-Lizenz, kostenfrei","ImageGlass Projekt","im Installationspaket","sc","https://imageglass.org/"
